퀄팩(qualpack),https://usercontents-c.styleshare.io/images/22319264/700x394,"퀄팩은 독특하지 않은 평범한 시각으로 제품을 만들고 있습니다.
일상 생활에서 어디서든 가볍게 들 수 있는 보통 사람의 데일리 백이 되길 바랍니다."
퀸트로,https://usercontents-c.styleshare.io/images/43012371/700x394,Essentials of Home : 퀸트로는 심플한 디자인으로 생활에 꼭 필요한 가전을 만드는 생활가전 브랜드입니다.
큐리티,https://usercontents-c.styleshare.io/images/33189540/700x394,"curetty(큐리티)는 cute 와 pretty의 합성어로 세상의 모든 귀여움과 예쁨을 소유하고 싶은 10대 소녀들의 이야기를 담고 있습니다.
SNS를 통해 자기 개성을 나타내고 싶은 10대들에게 유니크하면서 활용도 높은 아이템들을 제안합니다."
큐어시스(CURESYS),https://usercontents-c.styleshare.io/images/25374364/700x394,"CURESYS : CURE + SYSTEM 당신의 가치를 알기에,믿음에 대한 약속
큐어시스는 일대일 병원 치료는 아니지만, 매일 피부에 손쉽게 사용이 가능하며, 전문적인 관리 하에 피부개선 효과를 누릴 수 있는 데일리 케어 제품을 선보이겠다는 일념으로 시작하였습니다."
크람(KRAM),https://usercontents-c.styleshare.io/images/41555430/700x394,"매일 매일 따뜻하고 가벼운 발걸음의 행복함을 느껴보세요.


스웨덴식 인사 KRAM : 크람
스웨디쉬들은 반가운 포옹 ‘ Kram (크람) ’으로 기쁜 마음을 표현 합니다. 
Kram은 서로의 심장의 온기가 느껴질 정도로 가깝게 포옹을 하는 스웨덴식 인사를 의미 합니다.
Kram은 그들의 따뜻한 허그처럼‘행복을 더하다’라는 슬로건으로 시작 되었습니다.


우리가 하는 사소한 행동들 하나 하나에서 영감을 얻고
즐거움을 느끼고, 일상생활 속 평범한 순간들을 더욱 특별하게
만드는 데일리 라이프 스타일을 제안 합니다."
크랭크,https://usercontents-c.styleshare.io/images/39946371/700x394,"크랭크는 괴짜, 별난 사람이란 뜻으로 유니크한 사람들의 라이프 스타일과 감성을 장난스러운 디자인으로 풀어 선보이는 스트릿 브랜드입니다."
크럼프,https://usercontents-c.styleshare.io/images/8e0fc045-3731-4f15-bc14-9ebe8bb67902/700x394,Crump는 스트릿의 한 장르인 Krump와 Cloth의 합성어로 진취적이고 역동적인 스트릿 웨어를 지향하는 PUBLIC STREET BRAND입니다. have belied 라는 슬로건 아래 획일화된 사회통념에 억압받지 않고 자신만의 신념을 지켜나가길 응원합니다. Crump는 스트릿 감성을 기반으로 한 진취적인 메세지를 옷을 통해 공유하길 바랍니다.
크렁크베어,https://usercontents-c.styleshare.io/images/35580628/700x394,KRUNK(크렁크)는 YG 아티스트로 등록되어 있으며 YG 엔터테인먼트에서 여러 활동을 펼치고 다양한 굿즈로 판매되고 있는 셀럽 베어 캐릭터 브랜드입니다.
크렘,https://usercontents-c.styleshare.io/images/19588000/700x394,"크렘은 욕실의 기본인 “비누”로부터 시작하는 라이프 스타일 브랜드입니다. 불어로 크림, 진하고 달콤한 리쾨르, 가장 좋은 것을 뜻하는 “크렘”은, 디자트나 음료 위를 부드럽게 꾸며주는 것처럼 일상에 더해지는 Rich and Sweet을 추구합니다."
크로스드레슬리,https://usercontents-c.styleshare.io/images/21037527/700x394,"Crossdressly는 남녀 상관없이 누구나 입을 수 있으며, 매 시즌 다양한 소재로 디자인합니다.
보통 주변에서 쉽게 볼 수 있는 사물, 풍경을 옷에 자연스럽게 담아내며 디자인합니다."
크로스애비뉴,https://usercontents-c.styleshare.io/images/26383142/700x394,CROSS AVENUE는 톱니바퀴처럼 굴러가는 일상생활의 굴레에서 벗어나 자유로움을 갈망하는 10/20/30대 누구나 입을 수 있는 STREET BRAND 입니다.
크로스커렌트,https://usercontents-c.styleshare.io/images/31870454/700x394,크로스커렌트는 미니멀리즘을 기반으로한 스트릿브랜드입니다.
크록스,https://usercontents-c.styleshare.io/images/18900309/700x394,"CROCS(크록스)는 미국 콜로라도 볼더에서 소박하면서도 편안한 보트 슈즈로 시작한 크록스 슈즈는 오늘날 수백스타일의 남성용, 여성용, 어린이용 스타일이 전세계에서 판매되고 있습니다. 차별화된 컬렉션을 가지고 있는 크록스는 사계절, 어느때나 잘 어울리며 컬러풀하고 가벼워 편안함을 드립니다."
크루클린,https://usercontents-c.styleshare.io/images/34704196/700x394,크루클린은 간편한 캐주얼룩부터 자유분방한 스트릿웨어까지 구사하는 감각적인 컬러와 옷의 퀄리티를 중요시하는 스트릿 캐주얼 브랜드입니다.
크리니크,,
크리드,https://usercontents-c.styleshare.io/images/33271989/700x394,유럽 왕실이인정한 향기의 명가. 250년의 역사 만큼 변하지 않는 가치를 지닌 니치향수 대표 브랜드입니다.
크리스브라운,https://usercontents-c.styleshare.io/images/22758597/700x394,CHRISBROWN(크리스브라운)은 미국의 유명 R&B 팝가수 Chris Brown의 자유분방하고 격식없는 음악세계를 동경하여 만들어진 데일리 컨템포러리 캐쥬얼 브랜드입니다. 베이직에 근간한 identity를 지키면서 적절한 trend를 접목하는 컨셉으로 젊은 감각의 pure casual을 지향합니다.
크리스찬 루부탱,https://usercontents-c.styleshare.io/images/42727292/700x394,"관능적인 레드솔로 전 세계 여성을 사로잡은 크리스찬 루부탱(Christian Louboutin). 파리에서 태어난 Christian Louboutin은 이탈리아에서 신발 제작 기능을 익혔고, 명품 브랜드의 슈즈 디자이너로 활동하며 경험을 쌓은 후 자신의 브랜드를 론칭하였습니다. 

직원이 칠한 매니큐어에서 영감을 받아 탄생한 시그니처 레드솔은 사랑과 열정의 상징으로 정열적이고 섹시한 브랜드의 아이덴티티를 표현합니다. 이탈리아의 장인정신과 감각적인 파리지앵 디자인으로 완성된 크리스찬 루부탱의 슈즈 컬렉션을 만나보세요."
크리스찬디올,https://usercontents-c.styleshare.io/images/42756679/700x394,
크리스챤디올,https://usercontents-c.styleshare.io/images/b2972f43-ac2e-4fc0-b743-5aae219aabd7/700x394,
크리스틴,https://usercontents-c.styleshare.io/images/20292810/700x394,크리스틴(KRISTIN)은 세상에서 가장 편안한 신발을 만드는 것을 지향하는 브랜드로 편안함을 중심으로 심플하면서도 감각적인 디자인을 추구합니다. 디자인부터 생산까지 직접 모든 작업을 진행하는 전문적인 디자이너 슈즈 브랜드로 캔버스화 최초로 천연라텍스화를 직접 제작하고 있습니다. 아시아를 비롯하여 전세계 슈즈패션을 선도하는 국내 유일의 프리미엄 여성 슈즈 브랜드입니다.
크림스랩,https://usercontents-c.styleshare.io/images/34521057/700x394,"크림스랩은 베이직하고 모던한 실루엣과 유니크한 감각적인 스타일을 제안합니다.
합리적이며 편안함과 기능성, 멋을 동시에 추구할 수 있는 스타일리쉬한 제품을 만나보실 수 있습니다."
크림슨코크,https://usercontents-c.styleshare.io/images/22817358/700x394,"크림슨코크는 순수미술 작업을 통해 회화적인 감성이 담긴 디자인을 만듭니다.
모든 제품은 소속 작가의 드로잉 , 수채화 그림을 기반으로 하여 제작됩니다.
제품을 통해 어느 작가의 작품을 감상하는 듯한 기분을 느낄 수 있도록, 
크림슨코크만의 자연적이고, 독특한 그림체의 감성을 공유합니다."
클라란스,,
클락스,https://usercontents-c.styleshare.io/images/5691dc8f-0708-4767-b863-b26c729ec38e/700x394,
클래씨,https://usercontents-c.styleshare.io/images/40192246/700x394,"BE SLIM!
클래씨 서울은 레그쉐이퍼, 레그라이너와 같은 다리가 얇아지는 뷰티템을 통해 편리한 방법으로 여성들의 니즈를 맞춰나가고 있는 브랜드 입니다."
클랙스클로,https://usercontents-c.styleshare.io/images/42127740/700x394,"CLAXCLO는 'Classic'의 의미에 모티브를 두고 있는 디자이너 브랜드입니다.
변하지 않고 오랜시간 지속될 수 있는 스타일을 추구하며,
누구나 편하게 입을 수 있고 누구에게나 의미있는 디자인으로 다가가고자 합니다.
평범함과 특별함의 균형을 이룰 수 있는 'Item',
한장의 옷보다는 하나의 'Classic'이 되길 지향합니다."
클랜디,https://usercontents-c.styleshare.io/images/38389147/700x394,
클럿 스튜디오,https://usercontents-c.styleshare.io/images/18900305/700x394,CLUT STUDIO(클럿 스튜디오)는 하이패션을 지향하는 동시에 하위문화를 동경하는 독특한 성향의 브랜드입니다. 이는 넓은 스펙트럼을 가능하게 해 다양한 방법으로 제품에 녹아내립니다
클레어스,https://usercontents-c.styleshare.io/images/32344855/700x394,클레어스(klairs)는 민감성 피부를 위한 저자극 스킨케어 브랜드 입니다.
클레이,https://usercontents-c.styleshare.io/images/43003399/700x394,"2016년 가을/겨울 시즌 새롭게 선보이는 브랜드 Clae는 2001년 런칭한 브랜드로, 로스엔젤레스의 라이프 스타일을 추구하는 미국 브랜드이다. Clae는 로스엔젤레스의 역동적인 라이프 스타일과 감성을 반영하여 클래식한 실루엣의 footwear를 Clae만의 현대적인 감각으로 재해석한 컬렉션을 선보이고 있다."
클레터로즈,https://usercontents-c.styleshare.io/images/64829678-d814-47bb-ba4a-9c7fbbe07b85/700x394,"특별해지고 싶을 땐, 클레터로즈와 함께 하세요!"
클로란,,
클로이,https://usercontents-c.styleshare.io/images/39612629/700x394,"당신의 일상을 함께 공유하는 cloi

누군가는 취미생활에, 
누군가는 나른한 오후를 보내며, 
누군가는 데이트 준비를 하며, 
클로이 시계와 함께 시간을 보냅니다.

 

클로이는 여러분의 일상이 
더욱 풍부하고 스타일리쉬 할 수 있도록, 
합리적인 가격으로 다가가는 디자이너 브랜드 입니다."
클로티,https://usercontents-c.styleshare.io/images/43228198/700x394,"CLOTTY는 시그니처 심볼 솜사탕을 연상하여 '몽글몽글' 이라는 뜻을 담았다. 심볼 솜사탕과 로고플레이, 일상에서 어우러지는 유니크한 컬러를 사용해 유스컬처를 지향하는 영 캐주얼 브랜드이다."
클루,https://usercontents-c.styleshare.io/images/42566299/700x394,"<러블리 감성 토털 액세서리> 클루는 2005년부터 꾸준히 사랑 받아온 러블리 감성 액세서리 브랜드로

실버와 골드 쥬얼리부터 시계, 지갑과 미니백의 다양한 기프트를 제안합니다."
클루즈(CLUSE),https://usercontents-c.styleshare.io/images/38512753/700x394,"클루즈 워치는 단순함에서 아름다움을 찾는 사람들에게 사랑받는 브랜드로써
단순한 것은 평범한 것이 아니라 생각하여 산만함에서 벗어나 
삶에서 정말로 중요한 것들에 집중했습니다.
이러한 사고 방식을 통해 클루즈 워치는 우아함과 미니멀리즘을 대표하는
시계를 만드는 데 전념하고 있습니다.
그들의 스타일을 표현하는 사람들의 일부가되기를 희망하는 시계.
클루즈 워치는 최고의 모습을 보여 주며 스타일을 완성합니다.
클루즈 시계는 재료,품질,및 스타일에 중점을두고 주의와 주의를 기울여 생산되며
암스테르담 생산지에는 새로운 모델의 품질을 보장하기 위해
품질 관리 및 수리 전문 시계 제조사가 두어 관리하고 있습니다."
클리오,https://usercontents-c.styleshare.io/images/42444326/700x394,
클린,,
키르시,https://usercontents-c.styleshare.io/images/dcd1f99d-c965-4aed-b470-4c91fa7f600c/700x394,"KIRSH(키르시)는 2008년 ""CORPORATE ROCK&ROLL""이란 슬로건 아래 시작 된 VIVA STUDIO의 새로운 레이블입니다. ""Research and Creativity""를 IDENTITY로 KIRSH는 문화와 시대현상에 대한 수 많은 관심과 관찰을 통해, 새로운 것을 창조하는 이 시대의 젊음과 그 들의 의복을 대변합니다."
키르시 블렌딩,https://usercontents-c.styleshare.io/images/8c8eb088-731b-48ae-a149-a8651c3a730a/700x394,"2015년 설립된, 체리 심볼을 가진 의류 브랜드 KIRSH에서 새롭게 런칭한 ""Cosmetic"" 
kirsh 의 발랄하고 생기 넘치는 감성과 나만의 분위기를 닮은 컬러를 선택하여 만들어가는 완벽한 blending"
키메리,https://usercontents-c.styleshare.io/images/42197333/700x394,"간편하되 확실하게, 원 아이템 솔루션 뷰티 브랜드 입니다."
키스미,https://usercontents-c.styleshare.io/images/24363926/700x394,"KISS ME(키스미)는 별도의 스타 마케팅이나 광고 없이도, 제품을 사용해 본 고객들을 중심으로 입소문이 퍼져, 일본은 물론 국내 및 해외시장에서 많은 여성들에게 사랑받고 있습니다."
키치니,https://usercontents-c.styleshare.io/images/33653602/700x394,"키치니는 컨템포러리 유니섹스 브랜드로서, 한국의 스트릿 문화를 기반으로 매시즌마다, 새로운 트랜드를 제시합니다. 
키치니만의 스타일과 무드로 트랜디하면서도, 언제 어디서든지 누구나 즐길 수 있는 하나의 문화로서 남아있고자 노력하겠습니다."
키치스(KITSCHS),https://usercontents-c.styleshare.io/images/35446336/700x394,"KITSCH ART 와 CULTURE의 감성을 담아, 위트있는 아트웍으로 
재해석한 스트릿 감성의 유니섹스 의류 제품입니다.
진지함보다는 가벼움, 메시지보다는 재미, 주류보다는 비주류의 B급감성을 통한
우리 주변 문화속 억압된 행동과 표현들을 아트웍으로 표현함으로써 
일상속 평범함을 거부하고 키치스만의 유니크함을 추구합니다."
